<?xml version="1.0" encoding="UTF-8"?>
<ns:PurchaseOrder xmlns:ns="Excel" xmlns:xsi="http://www.w3.org/2001/XMLSchema-instance" xsi:schemaLocation="Excel Excel.xsd ">
  <ns:Items>
    <ns:itemCount>1223</ns:itemCount>
    <ns:Item>
      <ns:yourPartnerNumber>d38292</ns:yourPartnerNumber>
      <ns:unitPrice>15.3</ns:unitPrice>
      <ns:unitOfMeasure>kg</ns:unitOfMeasure>
      <ns:salesValue>30.4</ns:salesValue>
      <ns:quantity>2</ns:quantity>
      <ns:partNumber>s667</ns:partNumber>
      <ns:partDescription>potatos</ns:partDescription>
      <ns:itemNumber>243</ns:itemNumber>
    </ns:Item>
  </ns:Items>
  <ns:DeliverTo>
    <ns:Contact>
      <ns:contactName>Dr. Gilboa Barak</ns:contactName>
      <ns:companyName>Shuk ha karmel</ns:companyName>
      <ns:e-mail>shuk@gmail.com</ns:e-mail>
      <ns:telephone>03-2193822</ns:telephone>
    </ns:Contact>
    <ns:Address>
      <ns:street1>karmel 67</ns:street1>
      <ns:street2></ns:street2>
      <ns:street3></ns:street3>
      <ns:street4></ns:street4>
      <ns:stateProvince></ns:stateProvince>
      <ns:postalCode>26534</ns:postalCode>
      <ns:country>Israel</ns:country>
      <ns:city>Tel Aviv</ns:city>
    </ns:Address>
  </ns:DeliverTo>
  <ns:InvoiceTo>
    <ns:Contact>
      <ns:contactName>Dr. Gilboa Barak</ns:contactName>
      <ns:companyName>Shuk ha karmel</ns:companyName>
      <ns:e-mail>shuk@gmail.com</ns:e-mail>
      <ns:telephone>03-9823373</ns:telephone>
    </ns:Contact>
    <ns:Address>
      <ns:street1>karmel 67</ns:street1>
      <ns:street2></ns:street2>
      <ns:street3></ns:street3>
      <ns:street4></ns:street4>
      <ns:stateProvince></ns:stateProvince>
      <ns:postalCode>56887</ns:postalCode>
      <ns:country>Israel</ns:country>
      <ns:city>Tel Aviv</ns:city>
    </ns:Address>
  </ns:InvoiceTo>
  <ns:Header>
    <ns:orderNum>PO937506</ns:orderNum>
    <ns:orderDate>2013-12-23</ns:orderDate>
    <ns:ourAccountCode>s6780</ns:ourAccountCode>
    <ns:yourAccountCode>a5678</ns:yourAccountCode>
    <ns:Contact>
      <ns:contactName>Dr. Gilboa Barak</ns:contactName>
      <ns:companyName>Shuk ha karmel</ns:companyName>
      <ns:e-mail>shuk@gmail.com</ns:e-mail>
      <ns:telephone>03-9823373</ns:telephone>
    </ns:Contact>
  </ns:Header>
  <ns:Footer>
    <ns:totalValue>40.2</ns:totalValue>
  </ns:Footer>
</ns:PurchaseOrder>