<?xml version="1.0" encoding="UTF-8"?>
<ns:PurchaseOrder xmlns:ns="Excel" xmlns:xsi="http://www.w3.org/2001/XMLSchema-instance" xsi:schemaLocation="Excel Excel.xsd ">
  <ns:Items>
    <ns:itemCount>19</ns:itemCount>
    <ns:Item>
      <ns:yourPartnerNumber>787i74</ns:yourPartnerNumber>
      <ns:unitPrice>1258</ns:unitPrice>
      <ns:unitOfMeasure>kg</ns:unitOfMeasure>
      <ns:salesValue>1259854.58</ns:salesValue>
      <ns:quantity>58</ns:quantity>
      <ns:partNumber>t459</ns:partNumber>
      <ns:partDescription>Porsche early 944 924s relay/fuse box from a 1985 944</ns:partDescription>
      <ns:itemNumber>857599</ns:itemNumber>
    </ns:Item>
  </ns:Items>
  <ns:DeliverTo>
    <ns:Contact>
      <ns:contactName>Chandler Bing</ns:contactName>
      <ns:companyName>Cortica Ltd.</ns:companyName>
      <ns:e-mail>sales@cortica.com</ns:e-mail>
      <ns:telephone>(860) 832-2236</ns:telephone>
    </ns:Contact>
    <ns:Address>
      <ns:street1>Chestnut Street</ns:street1>
      <ns:street2>Eighth Avenue</ns:street2>
      <ns:street3>Pennsylvania Plaza</ns:street3>
      <ns:street4>96th Street</ns:street4>
      <ns:stateProvince>Arizona</ns:stateProvince>
      <ns:postalCode>58997</ns:postalCode>
      <ns:country>US</ns:country>
      <ns:city>Lake Havasu City</ns:city>
    </ns:Address>
  </ns:DeliverTo>
  <ns:InvoiceTo>
    <ns:Contact>
      <ns:contactName>Peter Dinklage</ns:contactName>
      <ns:companyName>Microsoft</ns:companyName>
      <ns:e-mail>pet.dinklage@microsoft.com</ns:e-mail>
      <ns:telephone>(877) 647-0788</ns:telephone>
    </ns:Contact>
    <ns:Address>
      <ns:street1>Plaza Way</ns:street1>
      <ns:street2>Orange Campus</ns:street2>
      <ns:street3>Building 5</ns:street3>
      <ns:street4>Suite #3246</ns:street4>
      <ns:stateProvince>Arizona</ns:stateProvince>
      <ns:postalCode>86442</ns:postalCode>
      <ns:country>US</ns:country>
      <ns:city>Bullhead City</ns:city>
    </ns:Address>
  </ns:InvoiceTo>
  <ns:Header>
    <ns:orderNum>4587525</ns:orderNum>
    <ns:orderDate>2011-09-11</ns:orderDate>
    <ns:ourAccountCode>U34A39</ns:ourAccountCode>
    <ns:yourAccountCode>U87A58</ns:yourAccountCode>
    <ns:Contact>
      <ns:contactName>Peter Dinklage</ns:contactName>
      <ns:companyName>Microsoft</ns:companyName>
      <ns:e-mail>pet.dinklage@microsoft.com</ns:e-mail>
      <ns:telephone>(877) 647-0788</ns:telephone>
    </ns:Contact>
  </ns:Header>
  <ns:Footer>
    <ns:totalValue>4785.36</ns:totalValue>
  </ns:Footer>
</ns:PurchaseOrder>
