<?xml version="1.0" encoding="UTF-8"?>
<ns:PurchaseOrder xmlns:ns="Excel" xmlns:xsi="http://www.w3.org/2001/XMLSchema-instance" xsi:schemaLocation="Excel Excel.xsd ">
  <ns:Items>
    <ns:itemCount>34</ns:itemCount>
    <ns:Item>
      <ns:yourPartnerNumber>r83984</ns:yourPartnerNumber>
      <ns:unitPrice>4500</ns:unitPrice>
      <ns:unitOfMeasure>unit</ns:unitOfMeasure>
      <ns:salesValue>4500</ns:salesValue>
      <ns:quantity>1</ns:quantity>
      <ns:partNumber>i934</ns:partNumber>
      <ns:partDescription>iphone 5</ns:partDescription>
      <ns:itemNumber>23</ns:itemNumber>
    </ns:Item>
  </ns:Items>
  <ns:DeliverTo>
    <ns:Contact>
      <ns:contactName>Miss Zoohar Malka</ns:contactName>
      <ns:companyName>Tiny Love</ns:companyName>
      <ns:e-mail>tlv@gmail.com</ns:e-mail>
      <ns:telephone>04-2637783</ns:telephone>
    </ns:Contact>
    <ns:Address>
      <ns:street1>Bareket 7</ns:street1>
      <ns:street2></ns:street2>
      <ns:street3></ns:street3>
      <ns:street4></ns:street4>
      <ns:stateProvince></ns:stateProvince>
      <ns:postalCode>27362</ns:postalCode>
      <ns:country>Israel</ns:country>
      <ns:city>Kiryat Yam</ns:city>
    </ns:Address>
  </ns:DeliverTo>
  <ns:InvoiceTo>
    <ns:Contact>
      <ns:contactName>Miss Zoohar Malka</ns:contactName>
      <ns:companyName>Tiny Love</ns:companyName>
      <ns:e-mail>tlv@gmail.com</ns:e-mail>
      <ns:telephone>04-2637783</ns:telephone>
    </ns:Contact>
    <ns:Address>
      <ns:street1>Bareket 7</ns:street1>
      <ns:street2></ns:street2>
      <ns:street3></ns:street3>
      <ns:street4></ns:street4>
      <ns:stateProvince></ns:stateProvince>
      <ns:postalCode>27362</ns:postalCode>
      <ns:country>Israel</ns:country>
      <ns:city>Kiryat Yam</ns:city>
    </ns:Address>
  </ns:InvoiceTo>
  <ns:Header>
    <ns:orderNum>PO293483</ns:orderNum>
    <ns:orderDate>2020-07-24</ns:orderDate>
    <ns:ourAccountCode>d7836</ns:ourAccountCode>
    <ns:yourAccountCode>w9722</ns:yourAccountCode>
    <ns:Contact>
      <ns:contactName>Miss Zoohar Malka</ns:contactName>
      <ns:companyName>Tiny Love</ns:companyName>
      <ns:e-mail>tlv@gmail.com</ns:e-mail>
      <ns:telephone>03-9823373</ns:telephone>
    </ns:Contact>
  </ns:Header>
  <ns:Footer>
    <ns:totalValue>5000</ns:totalValue>
  </ns:Footer>
</ns:PurchaseOrder>