<?xml version="1.0" encoding="UTF-8"?>
<ns:PurchaseOrder xmlns:ns="Excel" xmlns:xsi="http://www.w3.org/2001/XMLSchema-instance" xsi:schemaLocation="Excel Excel.xsd ">
  <ns:Items>
    <ns:itemCount>457</ns:itemCount>
    <ns:Item>
      <ns:yourPartnerNumber>2577iuy</ns:yourPartnerNumber>
      <ns:unitPrice>4558.58577</ns:unitPrice>
      <ns:unitOfMeasure>L</ns:unitOfMeasure>
      <ns:salesValue>4581.458</ns:salesValue>
      <ns:quantity>10.0</ns:quantity>
      <ns:partNumber>p754</ns:partNumber>
      <ns:partDescription>Jet Performance 67030 V-Force Plus</ns:partDescription>
      <ns:itemNumber>48856</ns:itemNumber>
    </ns:Item>
  </ns:Items>
  <ns:DeliverTo>
    <ns:Contact>
      <ns:contactName>Yulia Shkolnik</ns:contactName>
      <ns:companyName>Atmos Energy</ns:companyName>
      <ns:e-mail>shkolnik@mail.com</ns:e-mail>
      <ns:telephone>(623) 453-2670</ns:telephone>
    </ns:Contact>
    <ns:Address>
      <ns:street1>Christopher Street</ns:street1>
      <ns:street2>Forsyth Street</ns:street2>
      <ns:street3></ns:street3>
      <ns:street4></ns:street4>
      <ns:stateProvince>CONNECTICUT</ns:stateProvince>
      <ns:postalCode>13417</ns:postalCode>
      <ns:country>USA</ns:country>
      <ns:city>Hartford</ns:city>
    </ns:Address>
  </ns:DeliverTo>
  <ns:InvoiceTo>
    <ns:Contact>
      <ns:contactName>Yulia Shkolnik</ns:contactName>
      <ns:companyName>Atmos Energy</ns:companyName>
      <ns:e-mail>shkolnik@mail.com</ns:e-mail>
      <ns:telephone>(623) 453-2670</ns:telephone>
    </ns:Contact>
    <ns:Address>
      <ns:street1>Christopher Street</ns:street1>
      <ns:street2>Forsyth Street</ns:street2>
      <ns:street3></ns:street3>
      <ns:street4></ns:street4>
      <ns:stateProvince>CONNECTICUT</ns:stateProvince>
      <ns:postalCode>13417</ns:postalCode>
      <ns:country>USA</ns:country>
      <ns:city>Hartford</ns:city>
    </ns:Address>
  </ns:InvoiceTo>
  <ns:Header>
    <ns:orderNum>4587</ns:orderNum>
    <ns:orderDate>2005-07-01</ns:orderDate>
    <ns:ourAccountCode>K45L56</ns:ourAccountCode>
    <ns:yourAccountCode>K45L99</ns:yourAccountCode>
    <ns:Contact>
      <ns:contactName>Yulia Shkolnik</ns:contactName>
      <ns:companyName>Atmos Energy</ns:companyName>
      <ns:e-mail>amos@gmail.com</ns:e-mail>
      <ns:telephone>(520) 205-5008</ns:telephone>
    </ns:Contact>
  </ns:Header>
  <ns:Footer>
    <ns:totalValue>4550.0</ns:totalValue>
  </ns:Footer>
</ns:PurchaseOrder>
