<?xml version="1.0" encoding="UTF-8"?>
<ns:PurchaseOrder xmlns:ns="Excel" xmlns:xsi="http://www.w3.org/2001/XMLSchema-instance" xsi:schemaLocation="Excel Excel.xsd ">
  <ns:Items>
    <ns:itemCount>12</ns:itemCount>
    <ns:Item>
      <ns:yourPartnerNumber>d63457</ns:yourPartnerNumber>
      <ns:unitPrice>1237.82</ns:unitPrice>
      <ns:unitOfMeasure>kg</ns:unitOfMeasure>
      <ns:salesValue>1237.82</ns:salesValue>
      <ns:quantity>21</ns:quantity>
      <ns:partNumber>o975</ns:partNumber>
      <ns:partDescription>tomatos</ns:partDescription>
      <ns:itemNumber>12</ns:itemNumber>
    </ns:Item>
  </ns:Items>
  <ns:DeliverTo>
    <ns:Contact>
      <ns:contactName>Tzeala Azulay</ns:contactName>
      <ns:companyName>Tamam Taasiyit mazon</ns:companyName>
      <ns:e-mail>tmm@yandex.ru</ns:e-mail>
      <ns:telephone>03-1223383</ns:telephone>
    </ns:Contact>
    <ns:Address>
      <ns:street1>Ben Guriyon 5</ns:street1>
      <ns:street2></ns:street2>
      <ns:street3></ns:street3>
      <ns:street4></ns:street4>
      <ns:stateProvince></ns:stateProvince>
      <ns:postalCode>26534</ns:postalCode>
      <ns:country>Israel</ns:country>
      <ns:city>Petah Tikva</ns:city>
    </ns:Address>
  </ns:DeliverTo>
  <ns:InvoiceTo>
    <ns:Contact>
      <ns:contactName>Ayala Hason</ns:contactName>
      <ns:companyName>Tamam Taasiyit mazon</ns:companyName>
      <ns:e-mail>ayala@tamam.il</ns:e-mail>
      <ns:telephone>03-9823373</ns:telephone>
    </ns:Contact>
    <ns:Address>
      <ns:street1>Ben Guriyon 5</ns:street1>
      <ns:street2></ns:street2>
      <ns:street3></ns:street3>
      <ns:street4></ns:street4>
      <ns:stateProvince></ns:stateProvince>
      <ns:postalCode>56887</ns:postalCode>
      <ns:country>Israel</ns:country>
      <ns:city>Petah Tikva</ns:city>
    </ns:Address>
  </ns:InvoiceTo>
  <ns:Header>
    <ns:orderNum>PO122323</ns:orderNum>
    <ns:orderDate>2013-05-13</ns:orderDate>
    <ns:ourAccountCode>d7654</ns:ourAccountCode>
    <ns:yourAccountCode>f9872</ns:yourAccountCode>
    <ns:Contact>
      <ns:contactName>Ayala Hason</ns:contactName>
      <ns:companyName>Tamam Taasiyit mazon</ns:companyName>
      <ns:e-mail>tamam@resor.uk</ns:e-mail>
      <ns:telephone>03-9823373</ns:telephone>
    </ns:Contact>
  </ns:Header>
  <ns:Footer>
    <ns:totalValue>1227.2</ns:totalValue>
  </ns:Footer>
</ns:PurchaseOrder>