<?xml version="1.0" encoding="UTF-8"?>
<ns:PurchaseOrder xmlns:ns="Excel" xmlns:xsi="http://www.w3.org/2001/XMLSchema-instance" xsi:schemaLocation="Excel Excel.xsd ">
  <ns:Items>
    <ns:itemCount>85</ns:itemCount>
    <ns:Item>
      <ns:yourPartnerNumber>yyiuu8</ns:yourPartnerNumber>
      <ns:unitPrice>458.99</ns:unitPrice>
      <ns:unitOfMeasure>kg</ns:unitOfMeasure>
      <ns:salesValue>458772.74</ns:salesValue>
      <ns:quantity>45.66</ns:quantity>
      <ns:partNumber>y865</ns:partNumber>
      <ns:partDescription>Honda Stage 3 Performance Chip Fuel Engine Racing Speed MOD Plug n Play</ns:partDescription>
      <ns:itemNumber>458871</ns:itemNumber>
    </ns:Item>
  </ns:Items>
  <ns:DeliverTo>
    <ns:Contact>
      <ns:contactName>Patrick Stump</ns:contactName>
      <ns:companyName>Allegheny Technologies</ns:companyName>
      <ns:e-mail>Stumppet@yahoo.com</ns:e-mail>
      <ns:telephone>(623) 643-0399</ns:telephone>
    </ns:Contact>
    <ns:Address>
      <ns:street1>Camino San Xavier</ns:street1>
      <ns:street2></ns:street2>
      <ns:street3></ns:street3>
      <ns:street4></ns:street4>
      <ns:stateProvince>AZ</ns:stateProvince>
      <ns:postalCode>85308 </ns:postalCode>
      <ns:country>USA</ns:country>
      <ns:city>Glendale</ns:city>
    </ns:Address>
  </ns:DeliverTo>
  <ns:InvoiceTo>
    <ns:Contact>
      <ns:contactName>Patrick Stump</ns:contactName>
      <ns:companyName>Allegheny Technologies</ns:companyName>
      <ns:e-mail>Stumppet@yahoo.com</ns:e-mail>
      <ns:telephone>(623) 643-0399</ns:telephone>
    </ns:Contact>
    <ns:Address>
      <ns:street1>Camino San Xavier</ns:street1>
      <ns:street2></ns:street2>
      <ns:street3></ns:street3>
      <ns:street4></ns:street4>
      <ns:stateProvince>AZ</ns:stateProvince>
      <ns:postalCode>85308 </ns:postalCode>
      <ns:country>USA</ns:country>
      <ns:city>Glendale</ns:city>
    </ns:Address>
  </ns:InvoiceTo>
  <ns:Header>
    <ns:orderNum>75925</ns:orderNum>
    <ns:orderDate>2012-05-18</ns:orderDate>
    <ns:ourAccountCode>U34A88</ns:ourAccountCode>
    <ns:yourAccountCode>U34A74</ns:yourAccountCode>
    <ns:Contact>
      <ns:contactName>Patrick Stump</ns:contactName>
      <ns:companyName>Allegheny Technologies</ns:companyName>
      <ns:e-mail>Stumppet@yahoo.com</ns:e-mail>
      <ns:telephone>(480) 503-7355</ns:telephone>
    </ns:Contact>
  </ns:Header>
  <ns:Footer>
    <ns:totalValue>1570.05</ns:totalValue>
  </ns:Footer>
</ns:PurchaseOrder>