<?xml version="1.0" encoding="UTF-8"?>
<ns:PurchaseOrder xmlns:ns="Excel" xmlns:xsi="http://www.w3.org/2001/XMLSchema-instance" xsi:schemaLocation="Excel Excel.xsd ">
  <ns:Items>
    <ns:itemCount>15</ns:itemCount>
    <ns:Item>
      <ns:yourPartnerNumber>s7829</ns:yourPartnerNumber>
      <ns:unitPrice>1229000</ns:unitPrice>
      <ns:unitOfMeasure>unit</ns:unitOfMeasure>
      <ns:salesValue>1300000</ns:salesValue>
      <ns:quantity>2</ns:quantity>
      <ns:partNumber>w029</ns:partNumber>
      <ns:partDescription>BMW cars</ns:partDescription>
      <ns:itemNumber>5</ns:itemNumber>
    </ns:Item>
  </ns:Items>
  <ns:DeliverTo>
    <ns:Contact>
      <ns:contactName>Prof Ofer Shtrayhaman</ns:contactName>
      <ns:companyName>BMW import</ns:companyName>
      <ns:e-mail>Netanya@hotmail.com</ns:e-mail>
      <ns:telephone>04-2637783</ns:telephone>
    </ns:Contact>
    <ns:Address>
      <ns:street1>Hazorfim</ns:street1>
      <ns:street2></ns:street2>
      <ns:street3></ns:street3>
      <ns:street4></ns:street4>
      <ns:stateProvince></ns:stateProvince>
      <ns:postalCode>28933</ns:postalCode>
      <ns:country>Israel</ns:country>
      <ns:city>Netanya</ns:city>
    </ns:Address>
  </ns:DeliverTo>
  <ns:InvoiceTo>
    <ns:Contact>
      <ns:contactName>Prof Ofer Shtrayhaman</ns:contactName>
      <ns:companyName>BMW import</ns:companyName>
      <ns:e-mail>bmw@hotmail.com</ns:e-mail>
      <ns:telephone>09-3847382</ns:telephone>
    </ns:Contact>
    <ns:Address>
      <ns:street1>Hazorfim</ns:street1>
      <ns:street2></ns:street2>
      <ns:street3></ns:street3>
      <ns:street4></ns:street4>
      <ns:stateProvince></ns:stateProvince>
      <ns:postalCode>28933</ns:postalCode>
      <ns:country>Israel</ns:country>
      <ns:city>Netanya</ns:city>
    </ns:Address>
  </ns:InvoiceTo>
  <ns:Header>
    <ns:orderNum>PO203943</ns:orderNum>
    <ns:orderDate>2013-12-08</ns:orderDate>
    <ns:ourAccountCode>s7890</ns:ourAccountCode>
    <ns:yourAccountCode>w8765</ns:yourAccountCode>
    <ns:Contact>
      <ns:contactName>Prof Ofer Shtrayhaman</ns:contactName>
      <ns:companyName>BMW import</ns:companyName>
      <ns:e-mail>Netanya@hotmail.com</ns:e-mail>
      <ns:telephone>09-3847382</ns:telephone>
    </ns:Contact>
  </ns:Header>
  <ns:Footer>
    <ns:totalValue>1300000</ns:totalValue>
  </ns:Footer>
</ns:PurchaseOrder>